{
  "check_id": "grdr:deep-map-check:example-example-unit-core-native-structure",
  "state": "passed",
  "completion_basis": "The official versioned schema enumerates the complete native structure for this bounded work unit.",
  "evidence": [
    {
      "url": "https://example.org/official-schema",
      "title": "Official example schema",
      "evidence_type": "official_schema",
      "supports": ["native_structure", "version", "completion_boundary"],
      "retrieved_at": "2026-08-19T00:00:00Z"
    }
  ],
  "blockers": [],
  "notes": "Replace this example with the exact check ID and source evidence returned by database-deep-map-status."
}
